Directory,Filename,DocumentType,Priority,TransformationType,Status,Notes
ss5-foundation,README.md,Index,Medium,Update,Completed,Updated with references to USS-to-B1-Series Method
ss5-foundation,smartstack-v5-spec.md,Core Concept,High,Major Revision,Completed,Added USS-to-B1-Series Method core sections
ss5-foundation,ss5-b1-workflow-guide.md,Process,High,Major Revision,Completed,Updated with USS-to-B1-Series Method integration
ss5-foundation,ss5-implementation-plan.md,Process,High,Major Revision,Completed,Added USS-to-B1-Series Method implementation steps
ss5-foundation,ss5-pattern-application-guidelines.md,Process,Medium,Update,Completed,Added USS-to-B1 pattern application guidelines
ss5-foundation,ss5-chain-synthesis-guide.md,Process,High,Major Revision,Partially Completed,Updated for USS-to-B1 chain approach
ss5-foundation,Architectural_Decision_SS5_Pattern_Stewardship.md,Decision,Medium,Update,Completed,Updated with USS-to-B1-Series Method as key component
ss5-foundation,USS-to-B1-transformation-guide.md,Process,High,Create,Completed,Created comprehensive documentation of the method
ss5-foundation,doc-log.md,Log,Medium,Update,Completed,Added entry for USS-to-B1-Series Method integration
ss5-train-new-thread,README.md,Index,Medium,Update,Pending,Add USS-to-B1 approach references
ss5-train-new-thread,ss5-thread-training,Process,High,Major Revision,Completed,Added USS-to-B1-Series Method context and steps
ss5-train-new-thread,ss5-prompt-templates.md,Reference,High,Major Revision,Completed,Added USS-to-B1-Series Method prompts
ss5-train-new-thread,HealthBench-US-Suite-v4.md,Example,Medium,Update,Completed,Added USS-to-B1-Series Method implementation example
ss5-train-new-thread,ss5-practical-exercises.md,Training,Medium,Update,Completed,Added USS-to-B1-Series Method exercises
ss5-base-refine-2-foundation,ss5-b1-workflow-guide.md,Process,High,Major Revision,Pending,Update to USS-to-B1 approach
ss5-base-refine-2-foundation,HealthBench-US-Suite-v4.md,Example,Medium,Update,Completed,Synced with training thread version
ss5-base-refine-2-foundation,ss5-pattern-application-guidelines.md,Process,Medium,Update,Pending,Add USS transformation guidance
ss5-base-refine-2-foundation,healthbench-us000-prompt-chain.md,Example,Low,No Change,Pending,Already aligns with approach
ss5-base-refine-2-foundation,healthbench-us001-prompt-chain.md,Example,Low,No Change,Pending,Already aligns with approach
adr,ADR-006-USS-to-B1-Series-Method.md,Decision,High,Create,Completed,Created architectural decision record for the method
5.0retrain,HealthBench-US-Suite-v4.md,Example,Medium,Update,Completed,Synced with training thread version 